CheckId,DisplayName,Message,Severity,RawSeverity,TargetName,TargetType,Category,Description,Remediation,HelpLink,Status
"SPNaming","Stored procedure naming","Rename the following stored procedures to eliminate 'sp_' prefix: dbo.sp_WhoIsActive, dbo.sp_HealthParser, dbo.sp_HumanEvents, dbo.sp_HumanEventsBlockViewer, dbo.sp_IndexCleanup, dbo.sp_LogHunter, dbo.sp_PerfCheck, dbo.sp_PressureDetector, dbo.sp_QueryReproBuilder, dbo.sp_QuickieStore, dbo.sp_Blitz, dbo.sp_BlitzAnalysis, dbo.sp_BlitzBackups, dbo.sp_BlitzCache, dbo.sp_BlitzIndex, dbo.sp_BlitzLock, dbo.sp_BlitzWho, dbo.sp_DatabaseRestore, dbo.sp_ineachdb, dbo.sp_BlitzFirst","Information","Low","Server[@Name='MSI']/Database[@Name='PerformanceMonitor']","Database","DefaultRuleset, Naming","In SQL Server, the sp_ prefix designates system stored procedures. If you use that prefix for your stored procedures, the name of your procedure might conflict with the name of a system stored procedure that will be created in the future. If such a conflict occurs, your application might break if your application refers to the procedure without qualifying the reference by schema. In this situation, the name will bind to the system procedure instead of to your procedure.","","https://docs.microsoft.com/previous-versions/visualstudio/visual-studio-2010/dd172115(v=vs.100)","Failed"
"ColumnNamingSpecialChar","Special characters in column names","Remove whitespaces, left and right square brackets, single and double quotation marks from column names: collect.query_snapshots_20260303.dd hh:mm:ss.mss, collect.query_snapshots_20260304.dd hh:mm:ss.mss, collect.query_snapshots_20260305.dd hh:mm:ss.mss, collect.query_snapshots_20260306.dd hh:mm:ss.mss, collect.query_snapshots_20260307.dd hh:mm:ss.mss, collect.query_snapshots_20260308.dd hh:mm:ss.mss, collect.query_snapshots_20260309.dd hh:mm:ss.mss, collect.query_snapshots_20260310.dd hh:mm:ss.mss, collect.query_snapshots_20260311.dd hh:mm:ss.mss, collect.query_snapshots_20260312.dd hh:mm:ss.mss, collect.query_snapshots_20260313.dd hh:mm:ss.mss, collect.query_snapshots_20260314.dd hh:mm:ss.mss, report.query_snapshots.dd hh:mm:ss.mss, report.query_snapshots_blocking.dd hh:mm:ss.mss","Information","Low","Server[@Name='MSI']/Database[@Name='PerformanceMonitor']","Database","DefaultRuleset, Naming","Using whitespaces, left and right square brackets, single and double quotation marks in database object names makes it more difficult not only to reference that object, but also to read code that contains the name of that object.","","https://docs.microsoft.com/previous-versions/visualstudio/visual-studio-2010/dd172134(v=vs.100)","Failed"
"DeprFeaturesInModules","Deprecated or discontinued features in modules","Do not use deprecated or discontinued feature 'Data types: text ntext or image'. It probably is used in [collect].[database_configuration_collector], [collect].[default_trace_collector], [collect].[procedure_stats_collector], [collect].[query_snapshots_create_views], [collect].[query_snapshots_retention], [collect].[query_stats_collector], [collect].[query_store_collector], [collect].[trace_analysis_collector], [collect].[trace_management_collector], [collect].[waiting_tasks_collector], [config].[enable_realtime_monitoring], [config].[ensure_collection_table], [dbo].[sp_Blitz], [dbo].[sp_BlitzAnalysis], [dbo].[sp_BlitzBackups], [dbo].[sp_BlitzCache], [dbo].[sp_BlitzFirst], [dbo].[sp_BlitzIndex], [dbo].[sp_BlitzLock], [dbo].[sp_BlitzWho], [dbo].[sp_DatabaseRestore], [dbo].[sp_HealthParser], [dbo].[sp_HumanEvents], [dbo].[sp_HumanEventsBlockViewer], [dbo].[sp_IndexCleanup], [dbo].[sp_ineachdb], [dbo].[sp_LogHunter], [dbo].[sp_PerfCheck], [dbo].[sp_PressureDetector], [dbo].[sp_QueryReproBuilder], [dbo].[sp_QuickieStore], [dbo].[sp_WhoIsActive], [report].[blocking_chain_analysis], [report].[daily_summary_v2], [report].[expensive_queries_today], [report].[long_running_query_patterns], [report].[parameter_sensitivity_detection], [report].[procedure_stats_summary], [report].[procedure_stats_with_formatted_plans], [report].[query_snapshots_blocking], [report].[query_stats_summary], [report].[query_stats_with_formatted_plans], [report].[query_store_regressions], [report].[query_store_stats_with_formatted_plans], [report].[query_store_summary], [report].[tempdb_contention_analysis], [report].[top_memory_consumers]","Information","Low","Server[@Name='MSI']/Database[@Name='PerformanceMonitor']","Database","DefaultRuleset, Security, Deprecated","Deprecated features are scheduled to be removed in a future release of SQL Server. Discontinued features have been removed from specific versions of SQL Server.","","https://docs.microsoft.com/sql/relational-databases/performance-monitor/sql-server-deprecated-features-object","Failed"
"DeprFeaturesInModules","Deprecated or discontinued features in modules","Do not use deprecated or discontinued feature 'fn_trace_gettable'. It probably is used in [collect].[default_trace_collector], [collect].[trace_analysis_collector], [dbo].[sp_Blitz], [dbo].[sp_PerfCheck]","Information","Low","Server[@Name='MSI']/Database[@Name='PerformanceMonitor']","Database","DefaultRuleset, Security, Deprecated","Deprecated features are scheduled to be removed in a future release of SQL Server. Discontinued features have been removed from specific versions of SQL Server.","","https://docs.microsoft.com/sql/relational-databases/performance-monitor/sql-server-deprecated-features-object","Failed"
"DeprFeaturesInModules","Deprecated or discontinued features in modules","Do not use deprecated or discontinued feature 'sp_trace_create'. It probably is used in [collect].[trace_management_collector]","Information","Low","Server[@Name='MSI']/Database[@Name='PerformanceMonitor']","Database","DefaultRuleset, Security, Deprecated","Deprecated features are scheduled to be removed in a future release of SQL Server. Discontinued features have been removed from specific versions of SQL Server.","","https://docs.microsoft.com/sql/relational-databases/performance-monitor/sql-server-deprecated-features-object","Failed"
"DeprFeaturesInModules","Deprecated or discontinued features in modules","Do not use deprecated or discontinued feature 'sp_trace_setevent'. It probably is used in [collect].[trace_management_collector]","Information","Low","Server[@Name='MSI']/Database[@Name='PerformanceMonitor']","Database","DefaultRuleset, Security, Deprecated","Deprecated features are scheduled to be removed in a future release of SQL Server. Discontinued features have been removed from specific versions of SQL Server.","","https://docs.microsoft.com/sql/relational-databases/performance-monitor/sql-server-deprecated-features-object","Failed"
"DeprFeaturesInModules","Deprecated or discontinued features in modules","Do not use deprecated or discontinued feature 'sp_trace_setstatus'. It probably is used in [collect].[trace_management_collector]","Information","Low","Server[@Name='MSI']/Database[@Name='PerformanceMonitor']","Database","DefaultRuleset, Security, Deprecated","Deprecated features are scheduled to be removed in a future release of SQL Server. Discontinued features have been removed from specific versions of SQL Server.","","https://docs.microsoft.com/sql/relational-databases/performance-monitor/sql-server-deprecated-features-object","Failed"
"TableNoIndex","Tables without indexes","Review collect.query_snapshots_20260303 table and create reasonable indexes","Information","Low","Server[@Name='MSI']/Database[@Name='PerformanceMonitor']","Database","DefaultRuleset, Indexes, Performance","Each table in the database has one or more pages. To keep track of those pages, SQL Server uses a special set of pages, called IAM (for Index Allocation Map) pages. In spite of the word “Index” in the name, IAMs are used for non-indexed tables as well. These are called heaps. All the data is there, but the only way to find anything is to read it starting at the beginning. For a very large table, this will be terribly inefficient.","","https://docs.microsoft.com/sql/relational-databases/indexes/heaps-tables-without-clustered-indexes","Failed"
"TableNoIndex","Tables without indexes","Review collect.query_snapshots_20260304 table and create reasonable indexes","Information","Low","Server[@Name='MSI']/Database[@Name='PerformanceMonitor']","Database","DefaultRuleset, Indexes, Performance","Each table in the database has one or more pages. To keep track of those pages, SQL Server uses a special set of pages, called IAM (for Index Allocation Map) pages. In spite of the word “Index” in the name, IAMs are used for non-indexed tables as well. These are called heaps. All the data is there, but the only way to find anything is to read it starting at the beginning. For a very large table, this will be terribly inefficient.","","https://docs.microsoft.com/sql/relational-databases/indexes/heaps-tables-without-clustered-indexes","Failed"
"TableNoIndex","Tables without indexes","Review collect.query_snapshots_20260305 table and create reasonable indexes","Information","Low","Server[@Name='MSI']/Database[@Name='PerformanceMonitor']","Database","DefaultRuleset, Indexes, Performance","Each table in the database has one or more pages. To keep track of those pages, SQL Server uses a special set of pages, called IAM (for Index Allocation Map) pages. In spite of the word “Index” in the name, IAMs are used for non-indexed tables as well. These are called heaps. All the data is there, but the only way to find anything is to read it starting at the beginning. For a very large table, this will be terribly inefficient.","","https://docs.microsoft.com/sql/relational-databases/indexes/heaps-tables-without-clustered-indexes","Failed"
"TableNoIndex","Tables without indexes","Review collect.query_snapshots_20260306 table and create reasonable indexes","Information","Low","Server[@Name='MSI']/Database[@Name='PerformanceMonitor']","Database","DefaultRuleset, Indexes, Performance","Each table in the database has one or more pages. To keep track of those pages, SQL Server uses a special set of pages, called IAM (for Index Allocation Map) pages. In spite of the word “Index” in the name, IAMs are used for non-indexed tables as well. These are called heaps. All the data is there, but the only way to find anything is to read it starting at the beginning. For a very large table, this will be terribly inefficient.","","https://docs.microsoft.com/sql/relational-databases/indexes/heaps-tables-without-clustered-indexes","Failed"
"TableNoIndex","Tables without indexes","Review collect.query_snapshots_20260307 table and create reasonable indexes","Information","Low","Server[@Name='MSI']/Database[@Name='PerformanceMonitor']","Database","DefaultRuleset, Indexes, Performance","Each table in the database has one or more pages. To keep track of those pages, SQL Server uses a special set of pages, called IAM (for Index Allocation Map) pages. In spite of the word “Index” in the name, IAMs are used for non-indexed tables as well. These are called heaps. All the data is there, but the only way to find anything is to read it starting at the beginning. For a very large table, this will be terribly inefficient.","","https://docs.microsoft.com/sql/relational-databases/indexes/heaps-tables-without-clustered-indexes","Failed"
"TableNoIndex","Tables without indexes","Review collect.query_snapshots_20260308 table and create reasonable indexes","Information","Low","Server[@Name='MSI']/Database[@Name='PerformanceMonitor']","Database","DefaultRuleset, Indexes, Performance","Each table in the database has one or more pages. To keep track of those pages, SQL Server uses a special set of pages, called IAM (for Index Allocation Map) pages. In spite of the word “Index” in the name, IAMs are used for non-indexed tables as well. These are called heaps. All the data is there, but the only way to find anything is to read it starting at the beginning. For a very large table, this will be terribly inefficient.","","https://docs.microsoft.com/sql/relational-databases/indexes/heaps-tables-without-clustered-indexes","Failed"
"TableNoIndex","Tables without indexes","Review collect.query_snapshots_20260309 table and create reasonable indexes","Information","Low","Server[@Name='MSI']/Database[@Name='PerformanceMonitor']","Database","DefaultRuleset, Indexes, Performance","Each table in the database has one or more pages. To keep track of those pages, SQL Server uses a special set of pages, called IAM (for Index Allocation Map) pages. In spite of the word “Index” in the name, IAMs are used for non-indexed tables as well. These are called heaps. All the data is there, but the only way to find anything is to read it starting at the beginning. For a very large table, this will be terribly inefficient.","","https://docs.microsoft.com/sql/relational-databases/indexes/heaps-tables-without-clustered-indexes","Failed"
"TableNoIndex","Tables without indexes","Review collect.query_snapshots_20260310 table and create reasonable indexes","Information","Low","Server[@Name='MSI']/Database[@Name='PerformanceMonitor']","Database","DefaultRuleset, Indexes, Performance","Each table in the database has one or more pages. To keep track of those pages, SQL Server uses a special set of pages, called IAM (for Index Allocation Map) pages. In spite of the word “Index” in the name, IAMs are used for non-indexed tables as well. These are called heaps. All the data is there, but the only way to find anything is to read it starting at the beginning. For a very large table, this will be terribly inefficient.","","https://docs.microsoft.com/sql/relational-databases/indexes/heaps-tables-without-clustered-indexes","Failed"
"TableNoIndex","Tables without indexes","Review collect.query_snapshots_20260311 table and create reasonable indexes","Information","Low","Server[@Name='MSI']/Database[@Name='PerformanceMonitor']","Database","DefaultRuleset, Indexes, Performance","Each table in the database has one or more pages. To keep track of those pages, SQL Server uses a special set of pages, called IAM (for Index Allocation Map) pages. In spite of the word “Index” in the name, IAMs are used for non-indexed tables as well. These are called heaps. All the data is there, but the only way to find anything is to read it starting at the beginning. For a very large table, this will be terribly inefficient.","","https://docs.microsoft.com/sql/relational-databases/indexes/heaps-tables-without-clustered-indexes","Failed"
"TableNoIndex","Tables without indexes","Review collect.query_snapshots_20260312 table and create reasonable indexes","Information","Low","Server[@Name='MSI']/Database[@Name='PerformanceMonitor']","Database","DefaultRuleset, Indexes, Performance","Each table in the database has one or more pages. To keep track of those pages, SQL Server uses a special set of pages, called IAM (for Index Allocation Map) pages. In spite of the word “Index” in the name, IAMs are used for non-indexed tables as well. These are called heaps. All the data is there, but the only way to find anything is to read it starting at the beginning. For a very large table, this will be terribly inefficient.","","https://docs.microsoft.com/sql/relational-databases/indexes/heaps-tables-without-clustered-indexes","Failed"
"TableNoIndex","Tables without indexes","Review collect.query_snapshots_20260313 table and create reasonable indexes","Information","Low","Server[@Name='MSI']/Database[@Name='PerformanceMonitor']","Database","DefaultRuleset, Indexes, Performance","Each table in the database has one or more pages. To keep track of those pages, SQL Server uses a special set of pages, called IAM (for Index Allocation Map) pages. In spite of the word “Index” in the name, IAMs are used for non-indexed tables as well. These are called heaps. All the data is there, but the only way to find anything is to read it starting at the beginning. For a very large table, this will be terribly inefficient.","","https://docs.microsoft.com/sql/relational-databases/indexes/heaps-tables-without-clustered-indexes","Failed"
"TableNoIndex","Tables without indexes","Review collect.query_snapshots_20260314 table and create reasonable indexes","Information","Low","Server[@Name='MSI']/Database[@Name='PerformanceMonitor']","Database","DefaultRuleset, Indexes, Performance","Each table in the database has one or more pages. To keep track of those pages, SQL Server uses a special set of pages, called IAM (for Index Allocation Map) pages. In spite of the word “Index” in the name, IAMs are used for non-indexed tables as well. These are called heaps. All the data is there, but the only way to find anything is to read it starting at the beginning. For a very large table, this will be terribly inefficient.","","https://docs.microsoft.com/sql/relational-databases/indexes/heaps-tables-without-clustered-indexes","Failed"
"UnusedIndex","Unused index","Revise unused [server_info_history_start_time] index on [config].[server_info_history] table","Warning","Medium","Server[@Name='MSI']/Database[@Name='PerformanceMonitor']","Database","DefaultRuleset, Index, Performance","Unused indexes can slow down database's performance. Time of write operations is increased because of index maintenance, but index is not used anywhere.","","https://docs.microsoft.com/sql/t-sql/statements/drop-index-transact-sql","Failed"
"UnusedIndex","Unused index","Revise unused [collection_log_time_collector] index on [config].[collection_log] table","Warning","Medium","Server[@Name='MSI']/Database[@Name='PerformanceMonitor']","Database","DefaultRuleset, Index, Performance","Unused indexes can slow down database's performance. Time of write operations is increased because of index maintenance, but index is not used anywhere.","","https://docs.microsoft.com/sql/t-sql/statements/drop-index-transact-sql","Failed"
"UnusedIndex","Unused index","Revise unused [collection_log_status] index on [config].[collection_log] table","Warning","Medium","Server[@Name='MSI']/Database[@Name='PerformanceMonitor']","Database","DefaultRuleset, Index, Performance","Unused indexes can slow down database's performance. Time of write operations is increased because of index maintenance, but index is not used anywhere.","","https://docs.microsoft.com/sql/t-sql/statements/drop-index-transact-sql","Failed"
"UnusedIndex","Unused index","Revise unused [critical_issues_log_date] index on [config].[critical_issues] table","Warning","Medium","Server[@Name='MSI']/Database[@Name='PerformanceMonitor']","Database","DefaultRuleset, Index, Performance","Unused indexes can slow down database's performance. Time of write operations is increased because of index maintenance, but index is not used anywhere.","","https://docs.microsoft.com/sql/t-sql/statements/drop-index-transact-sql","Failed"
"UnusedIndex","Unused index","Revise unused [critical_issues_severity] index on [config].[critical_issues] table","Warning","Medium","Server[@Name='MSI']/Database[@Name='PerformanceMonitor']","Database","DefaultRuleset, Index, Performance","Unused indexes can slow down database's performance. Time of write operations is increased because of index maintenance, but index is not used anywhere.","","https://docs.microsoft.com/sql/t-sql/statements/drop-index-transact-sql","Failed"
"UnusedIndex","Unused index","Revise unused [critical_issues_source_collector] index on [config].[critical_issues] table","Warning","Medium","Server[@Name='MSI']/Database[@Name='PerformanceMonitor']","Database","DefaultRuleset, Index, Performance","Unused indexes can slow down database's performance. Time of write operations is increased because of index maintenance, but index is not used anywhere.","","https://docs.microsoft.com/sql/t-sql/statements/drop-index-transact-sql","Failed"
"UnusedIndex","Unused index","Revise unused [critical_issues_affected_database] index on [config].[critical_issues] table","Warning","Medium","Server[@Name='MSI']/Database[@Name='PerformanceMonitor']","Database","DefaultRuleset, Index, Performance","Unused indexes can slow down database's performance. Time of write operations is increased because of index maintenance, but index is not used anywhere.","","https://docs.microsoft.com/sql/t-sql/statements/drop-index-transact-sql","Failed"
"UnusedIndex","Unused index","Revise unused [database_configuration_history_time_db] index on [config].[database_configuration_history] table","Warning","Medium","Server[@Name='MSI']/Database[@Name='PerformanceMonitor']","Database","DefaultRuleset, Index, Performance","Unused indexes can slow down database's performance. Time of write operations is increased because of index maintenance, but index is not used anywhere.","","https://docs.microsoft.com/sql/t-sql/statements/drop-index-transact-sql","Failed"
"UnusedIndex","Unused index","Revise unused [UQ_ignored_wait_types_wait_type] index on [config].[ignored_wait_types] table","Warning","Medium","Server[@Name='MSI']/Database[@Name='PerformanceMonitor']","Database","DefaultRuleset, Index, Performance","Unused indexes can slow down database's performance. Time of write operations is increased because of index maintenance, but index is not used anywhere.","","https://docs.microsoft.com/sql/t-sql/statements/drop-index-transact-sql","Failed"
"StatSamplingRate","Statistics sampling rate","Some statistics have sampling rates less than 25.00%. Update with a larger sample or full scan if key is not uniformly distributed. Affected tables: collect.query_stats, collect.query_stats, collect.query_stats, collect.query_stats, collect.query_stats, collect.query_stats, collect.query_stats, collect.query_stats, collect.query_stats, collect.query_stats, collect.query_stats, collect.query_stats, collect.query_stats, collect.procedure_stats, collect.procedure_stats, collect.procedure_stats, collect.procedure_stats, collect.procedure_stats, collect.procedure_stats, collect.procedure_stats, collect.procedure_stats, collect.procedure_stats, collect.procedure_stats, collect.procedure_stats, collect.query_store_data, collect.query_store_data, collect.query_store_data, collect.query_store_data, collect.query_store_data, collect.query_store_data, collect.query_store_data, collect.query_store_data, collect.query_store_data","Information","Low","Server[@Name='MSI']/Database[@Name='PerformanceMonitor']","Database","DefaultRuleset, Performance, Statistics","For most queries, the Query Optimizer already generates the necessary statistics for a high quality query plan; in some cases, you need to create additional statistics or modify the query design for best results.","","https://docs.microsoft.com/sql/t-sql/statements/update-statistics-transact-sql","Failed"
"IndexFragmentation","Index Fragmentation","Remove fragmentation of collect.blocking_deadlock_stats.PK_blocking_deadlock_stats index. Current fragmentation level is 27.78%","Warning","Medium","Server[@Name='MSI']/Database[@Name='PerformanceMonitor']","Database","DefaultRuleset, Index, Performance","The SQL Server Database Engine automatically modifies indexes whenever insert, update, or delete operations are made to the underlying data. Over time these modifications can cause the information in the index to become scattered in the database (fragmented). Fragmentation exists when indexes have pages in which the logical ordering, based on the key value, does not match the physical ordering inside the data file. Heavily fragmented indexes can degrade query performance and cause your application to respond slowly, especially scan operations.","","https://docs.microsoft.com/sql/relational-databases/indexes/reorganize-and-rebuild-indexes","Failed"
"IndexFragmentation","Index Fragmentation","Remove fragmentation of collect.cpu_scheduler_stats.PK_cpu_scheduler_stats index. Current fragmentation level is 7.77%","Warning","Medium","Server[@Name='MSI']/Database[@Name='PerformanceMonitor']","Database","DefaultRuleset, Index, Performance","The SQL Server Database Engine automatically modifies indexes whenever insert, update, or delete operations are made to the underlying data. Over time these modifications can cause the information in the index to become scattered in the database (fragmented). Fragmentation exists when indexes have pages in which the logical ordering, based on the key value, does not match the physical ordering inside the data file. Heavily fragmented indexes can degrade query performance and cause your application to respond slowly, especially scan operations.","","https://docs.microsoft.com/sql/relational-databases/indexes/reorganize-and-rebuild-indexes","Failed"
"IndexFragmentation","Index Fragmentation","Remove fragmentation of collect.cpu_utilization_stats.PK_cpu_utilization_stats index. Current fragmentation level is 13.16%","Warning","Medium","Server[@Name='MSI']/Database[@Name='PerformanceMonitor']","Database","DefaultRuleset, Index, Performance","The SQL Server Database Engine automatically modifies indexes whenever insert, update, or delete operations are made to the underlying data. Over time these modifications can cause the information in the index to become scattered in the database (fragmented). Fragmentation exists when indexes have pages in which the logical ordering, based on the key value, does not match the physical ordering inside the data file. Heavily fragmented indexes can degrade query performance and cause your application to respond slowly, especially scan operations.","","https://docs.microsoft.com/sql/relational-databases/indexes/reorganize-and-rebuild-indexes","Failed"
