CheckId,DisplayName,Message,Severity,RawSeverity,TargetName,TargetType,Category,Description,Remediation,HelpLink,Status
"TF174","TF 174 increases plan cache bucket count","Enable trace flag 174 to increase plan cache bucket count","Information","Information","Server[@Name='MSI']","Server","DefaultRuleset, TraceFlag, Memory","Trace Flag 174 increases the SQL Server plan cache bucket count from 40,009 to 160,001 on 64-bit systems. When the SQL Server plan cache reaches its entry limit, plans that have low cost must be evicted in order to insert new plans. This can cause severe contention on the SOS_CACHESTORE spinlock and a high CPU usage occurs in SQL Server. On 64-bit systems, the number of buckets for the SQL Server plan cache is 40,009. Therefore, the maximum number of entries that can fit inside the SQL Server plan cache is 160,036. Enabling trace flag 174 on high performance systems increases the size of the cache and can avoid SOS_CACHESTORE spinlock contention.","","https://docs.microsoft.com/sql/t-sql/database-console-commands/dbcc-traceon-trace-flags-transact-sql","Failed"
"TF834","TF 834 enables large-page allocations","Enable trace flag 834 to use large-page allocations to improve analytical and data warehousing workloads","Information","Information","Server[@Name='MSI']","Server","DefaultRuleset, TraceFlag, Performance","Trace Flag 834 causes the server to use large-page memory (LPM) model for the buffer pool allocations. Consider enabling TF 834 if you have a server that has a lot of memory, particularly for an analytical or data warehousing workload. Trace flag 834 is NOT recommended on SQL Server instances that use columnstore indexes.","","https://support.microsoft.com/kb/3210239","Failed"
"DeprecatedFeatures","Deprecated or discontinued features should not be used","Use actual features for SQL Server version 16.0.4240 instead of found deprecated features: sp_trace_setfilter, sp_trace_setevent, sp_trace_setstatus, sp_trace_create, fn_trace_gettable, String literals as column aliases, '::' function calling syntax, sysprocesses, sysdatabases, syslogins, sysindexes, sysfiles, sysobjects, sysusers, SET FMTONLY ON, sp_trace_getdata, sp_db_vardecimal_storage_format, XP_API, USER_ID, Table hint without WITH, Data types: text ntext or image, More than two-part column name","Information","Low","Server[@Name='MSI']","Server","DefaultRuleset, Deprecated, Security","This check detects deprecated or discontinued features used on target SQL Server instances. Deprecated features may be removed in a future release of SQL Server. Discontinued features have been removed from specific versions of SQL Server.","","https://docs.microsoft.com/sql/relational-databases/performance-monitor/sql-server-deprecated-features-object","Failed"
"HintsStatistics","Hints are used","Use <join_hint>, <query_hint> and <table_hint> in specific cases only since SQL Server Query Optimizer typically selects best execution plan for queries","Information","Information","Server[@Name='MSI']","Server","DefaultRuleset, QueryOptimizer, Performance","Hints are options or strategies specified for enforcement by the SQL Server query processor on SELECT, INSERT, UPDATE, or DELETE statements. The hints override any execution plan the Query Optimizer might select for a query. Because the SQL Server Query Optimizer typically selects the best execution plan for a query, we recommend that <join_hint>, <query_hint>, and <table_hint> be used only as a last resort by experienced developers and database administrators.","","https://docs.microsoft.com/sql/t-sql/queries/hints-transact-sql","Failed"
"SystemHealth","System Health important messages","Error 17830 occured 35 times. Last time was 6 days ago","Error","High","Server[@Name='MSI']","Server","DefaultRuleset, XEvent, SystemHealth","The system_health session is an Extended Events session that is included by default with SQL Server. This session starts automatically when the SQL Server Database Engine starts, and runs without any noticeable performance effects. The session collects system data that you can use to help troubleshoot performance issues in the Database Engine","","https://docs.microsoft.com/sql/relational-databases/extended-events/use-the-system-health-session","Failed"
"BrowserSvcStoped","'SQL Server Browser' service is stopped","Run 'SQL Server Browser' service","Information","Low","Server[@Name='MSI']","Server","DefaultRuleset, Configuration","The 'SQL Server Browser' service is a name resolution service that provides SQL Server connection information to client computers.","","https://docs.microsoft.com/sql/database-engine/configure-windows/manage-the-database-engine-services","Failed"
"DiskPartitionAlignment","Disk Partition alignment","Increase disk partition alignment on Disk #1, Partition #0 to make it 64 KB at least. Current volume offset is 32768","Information","Low","Server[@Name='MSI']","Server","DefaultRuleset, Performance, Storage","Noncompliance with storage configuration best practices for the Microsoft SQL Server database software is a common root cause of support cases. The reason is often shown to be misalignment between Windows, storage, disk controllers, and cache segment lines. 64 KB is a common, valid starting partition offset because it correlates well with fundamental physical boundaries in disks, controllers, and cache. Other valid starting partition offsets exist.","","https://docs.microsoft.com/previous-versions/sql/sql-server-2008/dd758814(v=sql.100)","Failed"
"NtfsBlockSizeNotFormatted","NTFS block size in volumes with database files <> 64KB","Set allocation unit size on volume 'C:\' to 64 KB. Current size is 4096 bytes","Information","Low","Server[@Name='MSI']","Server","DefaultRuleset, Performance, Configuration","A drive can be formatted with different sizes ranging from 512 bytes to 64K sizes with the default being 4KB (4096 bytes). This setting is also called as “Bytes Per Cluster”. The atomic unit of storage in SQL Server is a page which is 8KB in size. Extents are groups of eight 8 KB pages that are physically contiguous to each other for a total of 64 KB. SQL Server uses extents to store data. Hence, on a SQL Server machine the NTFS Allocation unit size hosting SQL database files (Including tempdb files) should be 64 KB.","","https://docs.microsoft.com/archive/blogs/docast/operating-system-best-practice-configurations-for-sql-server","Failed"
"OleAutomationProceduresOn","Option 'Ole Automation Procedures' set to default","Disable 'Ole Automation Procedures' option to avoid security risks","Information","Low","Server[@Name='MSI']","Server","DefaultRuleset, Configuration, Security","Use the 'Ole Automation Procedures' option to specify whether OLE Automation objects can be instantiated within Transact-SQL batches. When OLE Automation Procedures are enabled, a call to 'sp_OACreate' will start the OLE shared execution environment. The 'Ole Automation Procedures' option can be set to the following values: 1 Enabled, 0 Disabled (default value).","","https://docs.microsoft.com/sql/database-engine/configure-windows/ole-automation-procedures-server-configuration-option","Failed"
"PageFileAutoManagedAllDrives","Page file is not automatically managed","Disable 'Automatically manage paging file size for all drives' option","Information","Low","Server[@Name='MSI']","Server","DefaultRuleset, Performance, Memory","Memory allocation failures can occur due to latencies that are associated with growing the size of a page file to support additional memory requirements in the system. A potential cause of these failures is when the page file size is configured as “automatic.” Automatic page-file size starts with a small page file and grows automatically as needed. The IO system consists of many components, including file system filters, file systems, volume filters, storage filters, and so on. The specific components on a given system can cause variability in page file growth. ","","https://support.microsoft.com/help/4055223/memory-allocation-errors-can-be-caused-by-slow-page-file-growth","Failed"
"PowerPlanSchemeNotRecommended","Power plan is High Performance","Switch server to High Performance power plan","Warning","Medium","Server[@Name='MSI']","Server","DefaultRuleset, Configuration, Performance","In some cases you may experience degraded overall performance on a Windows Server 2008 R2 or later machine when running with the default (Balanced) power plan. The issue may occur irrespective of platform and may be exhibited on both native and virtual environments. The degraded performance may increase the average response time for some tasks and cause performance issues with CPU-intensive applications. Please note that you may not notice performance issues while performing simple operations. However, applications or scripts that intensively use resources (primarily processor and memory) may exhibit the problem. To work around the performance degradation issue, you can switch to the High Performance power plan.  However, this will disable dynamic performance scaling on the platform. Depending on the environment, if the platform is always under a heavy load, then this is a viable solution.","","https://support.microsoft.com/help/2207548/slow-performance-on-windows-server-when-using-the-balanced-power-plan","Failed"
"RecoveryIntervalOn","Option 'recovery interval' set to default","Set 'recovery interval' option to 0. Current value is 1","Information","Low","Server[@Name='MSI']","Server","DefaultRuleset, Configuration, Performance","The 'recovery interval' option defines an upper limit on the time recovering a database should take. The default recovery-interval value is 0, which allows the Database Engine to automatically configure the recovery interval. Higher values indicate the approximate maximum recovery time, in minutes.","","https://docs.microsoft.com/sql/database-engine/configure-windows/configure-the-recovery-interval-server-configuration-option","Failed"
"RsSvcStoped","'Reporting Services' service is stopped","Run 'Reporting Services' service","Information","Low","Server[@Name='MSI']","Server","DefaultRuleset, Configuration","'The Reporting Services' service manages, executes, creates, schedules and delivers reports.","","https://docs.microsoft.com/sql/database-engine/configure-windows/manage-the-database-engine-services","Failed"
"ThresholdForParallelism","Option 'cost threshold for parallelism' set to default","Set 'cost threshold for parallelism' option to 5. Current value is 50","Warning","Medium","Server[@Name='MSI']","Server","DefaultRuleset, Configuration, Performance","The 'cost threshold for parallelism' option specifies the threshold at which SQL Server creates and runs parallel plans for queries. SQL Server creates and runs a parallel plan for a query only when the estimated cost to run a serial plan for the same query is higher than the value set in the cost threshold for parallelism. The cost refers to an estimated cost required to run the serial plan on a specific hardware configuration and is not a unit of time. The 'cost threshold for parallelism' option can be set to any value from 0 through 32767. The default value is 5.","","https://docs.microsoft.com/sql/database-engine/configure-windows/configure-the-cost-threshold-for-parallelism-server-configuration-option","Failed"
"XpCmdShellOn","Option 'xp_cmdshell' is disabled","Disable 'xp_cmdshell' as it exposes to security risks","Information","Low","Server[@Name='MSI']","Server","DefaultRuleset, Configuration","The xp_cmdshell option is a SQL Server configuration option that enables system administrators to control whether the xp_cmdshell extended stored procedure can be executed on a system. By default, the xp_cmdshell option is disabled on new installations. ","","https://docs.microsoft.com/sql/database-engine/configure-windows/xp-cmdshell-server-configuration-option","Failed"
"BackupTables","Too many rows in backup or restore history tables","Reduce number of rows in table 'msdb..backupfile' to less than 10000","Information","Information","Server[@Name='MSI']","Server","DefaultRuleset, Configuration","The upgrade process of a SQL Server instance may appear to hang if the number of rows in the following backup and restore system tables is very high: 'backupfile', 'backupmediafamily', 'backupmediaset', 'backupset', 'restorefile', 'restorefilegroup', 'restorehistory'. This is due to the fact that it would take longer to modify the backup and restore system tables in MSDB database.","","https://docs.microsoft.com/sql/relational-databases/system-stored-procedures/sp-delete-backuphistory-transact-sql","Failed"
"BackupTables","Too many rows in backup or restore history tables","Reduce number of rows in table 'msdb..backupmediafamily' to less than 10000","Information","Information","Server[@Name='MSI']","Server","DefaultRuleset, Configuration","The upgrade process of a SQL Server instance may appear to hang if the number of rows in the following backup and restore system tables is very high: 'backupfile', 'backupmediafamily', 'backupmediaset', 'backupset', 'restorefile', 'restorefilegroup', 'restorehistory'. This is due to the fact that it would take longer to modify the backup and restore system tables in MSDB database.","","https://docs.microsoft.com/sql/relational-databases/system-stored-procedures/sp-delete-backuphistory-transact-sql","Failed"
"BackupTables","Too many rows in backup or restore history tables","Reduce number of rows in table 'msdb..backupmediaset' to less than 10000","Information","Information","Server[@Name='MSI']","Server","DefaultRuleset, Configuration","The upgrade process of a SQL Server instance may appear to hang if the number of rows in the following backup and restore system tables is very high: 'backupfile', 'backupmediafamily', 'backupmediaset', 'backupset', 'restorefile', 'restorefilegroup', 'restorehistory'. This is due to the fact that it would take longer to modify the backup and restore system tables in MSDB database.","","https://docs.microsoft.com/sql/relational-databases/system-stored-procedures/sp-delete-backuphistory-transact-sql","Failed"
"BackupTables","Too many rows in backup or restore history tables","Reduce number of rows in table 'msdb..backupset' to less than 10000","Information","Information","Server[@Name='MSI']","Server","DefaultRuleset, Configuration","The upgrade process of a SQL Server instance may appear to hang if the number of rows in the following backup and restore system tables is very high: 'backupfile', 'backupmediafamily', 'backupmediaset', 'backupset', 'restorefile', 'restorefilegroup', 'restorehistory'. This is due to the fact that it would take longer to modify the backup and restore system tables in MSDB database.","","https://docs.microsoft.com/sql/relational-databases/system-stored-procedures/sp-delete-backuphistory-transact-sql","Failed"
"CompareRunConfigured","Run and config values are different","Use 'RECONFIGURE' after 'sp_configure' to update run value. Config value is different from run value in: min server memory (MB)","Information","Information","Server[@Name='MSI']","Server","DefaultRuleset, Performance, Configuration","SQL Server instance configuration settings have two values: a run value which is the currently active value and a config value which is the value that was last configured. Generally, these two values are the same, but if a setting has been changed but the change is not yet applied, confusion can arise for administrators and, in extreme cases, the system can become unstable.","","https://docs.microsoft.com/sql/relational-databases/system-catalog-views/sys-configurations-transact-sql","Failed"
"ContainedDbAuthentication","Non-default value for 'contained database authentication' option","Review non-default value 1 for the 'contained database authentication' option","Information","Information","Server[@Name='MSI']","Server","DefaultRuleset, Configuration, Security","When contained databases are enabled, database users other than members of the 'sysadmin' and 'securityadmin' fixed server roles can grant access to the instance of SQL Server.","","https://docs.microsoft.com/sql/database-engine/configure-windows/contained-database-authentication-server-configuration-option","Failed"
"DatabaseMailXPs","Non-default value for 'Database Mail XPs' option","Review non-default value 1 for the 'Database Mail XPs' option","Information","Information","Server[@Name='MSI']","Server","DefaultRuleset, Configuration, Security","Configuring the 'Database Mail XPs' option to 1 enables Database Mail on the instance of SQL Server. This configuration is off by default to reduce the attack surface area of SQL Server. Do not enable this functionality unless you intend to use Database Mail.","","https://docs.microsoft.com/sql/database-engine/configure-windows/database-mail-xps-server-configuration-option","Failed"
"DisallowResultsTriggers","Option 'disallow results from triggers' is disabled","Enable 'disallow results from triggers' option as the ability to return result sets from triggers will be removed in a future version","Information","Information","Server[@Name='MSI']","Server","DefaultRuleset, Configuration","Use the 'disallow results from triggers' option to control whether triggers return result sets. Triggers that return result sets may cause unexpected behavior in applications that are not designed to work with them.","","https://docs.microsoft.com/sql/database-engine/configure-windows/disallow-results-from-triggers-server-configuration-option","Failed"
"MaxTextReplSize","Non-default value for 'max text repl size' option","Review non-default value -1 for the 'max text repl size' option","Information","Information","Server[@Name='MSI']","Server","DefaultRuleset, Configuration","The 'max text repl size' option sets the maximum bytes of varchar(max), nvarchar(max), varbinary(max), xml, image, text, and ntext data that can be replicated in a single INSERT, UPDATE, WRITETEXT, or UPDATETEXT operation. If your data modifications exceed this value on replicated columns, you must increase it.","","https://docs.microsoft.com/sql/database-engine/configure-windows/configure-the-max-text-repl-size-server-configuration-option","Failed"
"RemoteDAC","Non-default value for 'remote admin connections' option","Review non-default value 1 for the 'remote admin connections' option","Information","Low","Server[@Name='MSI']","Server","DefaultRuleset, Security, Configuration","The 'remote admin connections' option enables remote connections to the dedicated administrator connection (DAC) on a Microsoft SQL Server instance. By default, this option is disabled and allows only a local client connection to the DAC. Leave this option disabled if you want to restrict DAC access to only the local client on the stand-alone server. If your SQL Server instance is on a cluster or if you want to use the DAC connection remotely and for some troubleshooting scenarios, you should enable this option.","","https://docs.microsoft.com/sql/database-engine/configure-windows/remote-admin-connections-server-configuration-option","Failed"
"DbDiffCollation","Database collation doesn't match master collation","Keep database collation the same as master or model collation","Warning","Medium","Server[@Name='MSI']/Database[@Name='Capitec_PowerBI']","Database","DefaultRuleset, DBConfiguration, Collation","We recommend that the collations of user-defined databases match the collation of master or model. Otherwise, collation conflicts can occur that might prevent code from executing. For example, when a stored procedure joins one table to a temporary table, SQL Server might end the batch and return a collation conflict error if the collations of the user-defined database and the model database are different. This occurs because temporary tables are created in tempdb, which bases its collation on that of model.","","https://docs.microsoft.com/sql/database-engine/set-collation-user-defined-databases-match-master-model-databases","Failed"
"AutoCreateStatsIncremental","Incremental option of auto stats should be ON","Turn on 'AUTO_CREATE_STATISTICS' and 'INCREMENTAL' options","Information","Low","Server[@Name='MSI']/Database[@Name='Capitec_PowerBI']","Database","DefaultRuleset, DBConfiguration, Statistics","Incremental statistics update at partition level is a feature introduced in SQL Server 2014. When the option INCREMENTAL is turn on at the database level, newly auto created column statistics will use incremental statistics on partitioned tables by default.","","https://docs.microsoft.com/sql/relational-databases/statistics/statistics","Failed"
"ObjectNamingSpecialChar","Special characters in object names","Rename the following objects to eliminate special characters: dbo.Channel Accs set Aug17 with Trans, dbo.FINVISION CODING, dbo.GuardRisk Accs set Aug17 with Trans, dbo.LocalDateTable_36a9c13a-313a-444f-9fa1-e4f5f996211c, dbo.LocalDateTable_50d4d66d-9a94-48f2-83c8-ff48f1f17aa4, dbo.LocalDateTable_6973eecc-1508-4c31-abb0-eae62f4a19db, dbo.LocalDateTable_c6cd0777-33c8-44a9-944a-5d00f2cab81c, dbo.Populate for capitec request, dbo.RESULT PER ACCOUNT, dbo.Show Duplicate Entries between channels, dbo.SUMMARY OF RESULT, dbo.Term Loan, dbo.Tran Date Key Lookup_20170911, dbo.Tran_Code Lookup_20170911","Information","Low","Server[@Name='MSI']/Database[@Name='Capitec_PowerBI']","Database","DefaultRuleset, Naming","If you name a database object by using any character in the following table, you make it more difficult not only to reference that object but also to read code that contains the name of that object.","","https://docs.microsoft.com/previous-versions/visualstudio/visual-studio-2010/dd172134(v=vs.100)","Failed"
"ColumnNamingSpecialChar","Special characters in column names","Remove whitespaces, left and right square brackets, single and double quotation marks from column names: dbo.ACCS.FINVISION CATEGORY, dbo.ACCS.VAT INDICATOR, dbo.ACCS_Cumulative.0. PAYMENT, dbo.ACCS_Cumulative.C* Initiation, dbo.ACCS_Cumulative.C* INTEREST, dbo.ACCS_Cumulative.C* PAYMENT, dbo.ACCS_Cumulative.Current TERM, dbo.ACCS_Cumulative.FINVISION CATEGORY, dbo.ACCS_Cumulative.Initiation Monthly, dbo.ACCS_Cumulative.Original TERM, dbo.ACCS_Cumulative.SEQ., dbo.ACCS_Cumulative.Tran Date, dbo.ACCS_Cumulative.Transaction Monthend Date, dbo.ACCS_Cumulative.VAT INDICATOR, dbo.ACCS_distinct.FINVISION CATEGORY, dbo.ACCS_distinct.VAT INDICATOR, dbo.ACCS_monthly_movement.Initiation Monthly, dbo.ACCS_monthly_movement.Interest Balance, dbo.ACCS_monthly_movement.Interest balance from last period, dbo.ACCS_monthly_movement.Left After Paying Fees, dbo.ACCS_monthly_movement.Left After Paying Interest, dbo.ACCS_monthly_movement.Made Payment, dbo.ACCS_monthly_movement.Paid Interest, dbo.ACCS_monthly_movement.Paid To Fees, dbo.ACCS_monthly_movement.Paid To Interest, dbo.ACCS_monthly_movement.Transaction Monthend Date, dbo.ACCS_toExcel.0. PAYMENT, dbo.ACCS_toExcel.Current TERM, dbo.ACCS_toExcel.FINVISION CATEGORY, dbo.ACCS_toExcel.Initiation Monthly, dbo.ACCS_toExcel.INTEREST Charged, dbo.ACCS_toExcel.Original TERM, dbo.ACCS_toExcel.SEQ., dbo.ACCS_toExcel.Tran Date, dbo.ACCS_toExcel.Transaction Monthend Date, dbo.ACCS_toExcel.VAT INDICATOR, dbo.ACCS_toExcel_no_filter.0. PAYMENT, dbo.ACCS_toExcel_no_filter.Current TERM, dbo.ACCS_toExcel_no_filter.FINVISION CATEGORY, dbo.ACCS_toExcel_no_filter.Initiation Monthly, dbo.ACCS_toExcel_no_filter.INTEREST Charged, dbo.ACCS_toExcel_no_filter.Original TERM, dbo.ACCS_toExcel_no_filter.SEQ., dbo.ACCS_toExcel_no_filter.Tran Date, dbo.ACCS_toExcel_no_filter.Transaction Monthend Date, dbo.ACCS_toExcel_no_filter.VAT INDICATOR, dbo.ACCS_toExcel_refined.0. PAYMENT, dbo.ACCS_toExcel_refined.FEE Exl VAT, dbo.ACCS_toExcel_refined.FEE Incl allocations, dbo.ACCS_toExcel_refined.FEE VAT, dbo.ACCS_toExcel_refined.FINVISION CATEGORY, dbo.ACCS_toExcel_refined.I Fee, dbo.ACCS_toExcel_refined.Initation Fee  VAT, dbo.ACCS_toExcel_refined.Initation Fee Excl VAT, dbo.ACCS_toExcel_refined.Initiation Monthly, dbo.ACCS_toExcel_refined.INTEREST Charged, dbo.ACCS_toExcel_refined.Payment check, dbo.ACCS_toExcel_refined.SEQ., dbo.ACCS_toExcel_refined.Tran Date, dbo.ACCS_toExcel_refined.VAT INDICATOR, dbo.CapitecPayout.INSURANCE PAYOUTDATE, dbo.CapitecPayout.INSURANCEPAYOUT PERIOD, dbo.CapitecPayout.INSURANCEPAYOUT VALUE, dbo.CapitecPayout.VAT INPUT ONINSURANCE PAYOUT, dbo.COMMENTS.CAPITEC: LOANS COVERED BY DEATH AND RETRENCHMENT INSURANCE PAYOUTS, dbo.FINVISION CODING.FINVISION CATEGORY, dbo.FINVISION CODING.VAT INDICATOR, dbo.Populate for capitec request.Admin Fee Exl VAT, dbo.Populate for capitec request.Admin Fee Incl VAT, dbo.Populate for capitec request.Admin Fee VAT only, dbo.Populate for capitec request.FINVISION CATEGORY, dbo.Populate for capitec request.Initation Fee, dbo.Populate for capitec request.Initation Fee  VAT, dbo.Populate for capitec request.Initation Fee Excl VAT, dbo.Populate for capitec request.INTEREST Charged, dbo.Populate for capitec request.Tran Date, dbo.Populate for capitec request.VAT INDICATOR, dbo.RESULT PER ACCOUNT.INSURANCE PAYOUT DATE, dbo.RESULT PER ACCOUNT.INSURANCE PAYOUT PERIOD, dbo.RESULT PER ACCOUNT.INSURANCE PAYOUT VALUE, dbo.RESULT PER ACCOUNT.VAT INPUT ON INSURANCE PAYOUT, dbo.Show Duplicate Entries between channels.FINVISION CATEGORY, dbo.SUMMARY OF RESULT.CAPITEC: LOANS COVERED BY DEATH AND RETRENCHMENT INSURANCE PAYOUTS","Information","Low","Server[@Name='MSI']/Database[@Name='Capitec_PowerBI']","Database","DefaultRuleset, Naming","Using whitespaces, left and right square brackets, single and double quotation marks in database object names makes it more difficult not only to reference that object, but also to read code that contains the name of that object.","","https://docs.microsoft.com/previous-versions/visualstudio/visual-studio-2010/dd172134(v=vs.100)","Failed"
